{
  "schemaVersion": 1,
  "packageName": "com.emailmessenger",
  "versionCode": 17,
  "versionName": "1.0.12",
  "apk": {
    "url": "https://github.com/Shadowez/emailmessenger-releases/releases/download/v1.0.12/EmailMessenger-1.0.12.apk",
    "sizeBytes": 68802053,
    "sha256": "fe55b0c8c3bfce553ac4231216e74194cdb4d978c88536ec874b6486728ab1af"
  },
  "releasePageUrl": "https://github.com/Shadowez/emailmessenger-releases/releases/tag/v1.0.12"
}
